{
  "id": "scu-mpa-2026",
  "school_id": "10610",
  "program_id": "scu-mpa-2026",
  "school_name": "四川大学",
  "school_label": "(10610)四川大学",
  "short_name": "川大",
  "program_type": "MPA",
  "degree_type": "双证",
  "exam_type": "全国联考",
  "province": "四川",
  "city": "成都",
  "school_level": "985/211/双一流",
  "school_level_display": "985",
  "department_label": "(101)经济学院",
  "major_category_label": "(1252)公共管理",
  "major_label": "(125200)公共管理",
  "direction": "公共经济与政府管理",
  "enrollment": 160,
  "tuition_min": 84000,
  "tuition_max": 84000,
  "duration": 3,
  "study_mode": "非全日制",
  "class_time": "周末",
  "class_location": "成都市",
  "latest_score": "185/55/110",
  "total_score": 185,
  "english_score": 55,
  "comprehensive_score": 110,
  "score_year": 2026,
  "adjustment": "否",
  "junior_college_allowed": "",
  "retired_soldier_plan": "否",
  "minority_backbone_plan": "否",
  "notes": "",
  "description": "川渝地区认可度高，适合重视院校层次、体制内认可和长期发展的人群。",
  "admission_analysis": "拟录取规模较大，但分数和复试压力也较高，建议搭配一所稳妥院校对比。",
  "retest_info": "复试包含思想政治和管理综合。",
  "tags": ["985", "211", "双一流", "周末班"],
  "filter_tags": ["管综系", "MPA", "四川", "成都", "非全日制", "7-9万", "985"],
  "sort_signals": {
    "cost_score": 6,
    "difficulty_score": 7,
    "work_friendly_score": 8,
    "recognition_score": 10
  },
  "publish": {
    "phase": "phase1",
    "version": "2026-05-initial",
    "published_at": "2026-05-14",
    "source_record_id": "scu-mpa-2026-nonfull-econ-01"
  }
}
